{
  "format_version": 1,
  "id": "math-elementary",
  "title": "數學國小",
  "subject": "math",
  "grades": [1, 2, 3, 4, 5, 6],
  "steps": [
    { "activity": "demo", "label": "看示範", "short": "示範", "phase": "learn" },
    { "activity": "manipulate", "label": "操作練習", "short": "操作", "optional": true },
    { "activity": "skill-practice", "label": "計算練習", "short": "計算", "count": 5 },
    { "activity": "quiz", "label": "小測驗", "short": "測驗", "count": 5 }
  ]
}
